{
  "references": [
    {
      "type": "blog",
      "value": "https://www.olcf.ornl.gov/2024/04/29/adaptable-io-system-delivers-the-data/",
      "title": "Adaptable IO System Delivers the Data",
      "authors": "ORNL",
      "year": "2024",
      "url": "https://www.olcf.ornl.gov/2024/04/29/adaptable-io-system-delivers-the-data/",
      "context": "Referenced as [1] discussing the I/O Wall problem and extreme scale capabilities",
      "metadata": {
        "source": "agent",
        "agent_type": "anthropic"
      }
    },
    {
      "type": "arxiv",
      "value": "2304.06603",
      "title": "Accelerating WRF I/O Performance with ADIOS2 and Network-based Streaming",
      "authors": "Laufer et al.",
      "year": "2023",
      "url": "https://arxiv.org/abs/2304.06603",
      "context": "Referenced as [2] for WRF case study, burst buffer support, aggregation, and compression performance",
      "metadata": {
        "source": "agent",
        "agent_type": "anthropic"
      }
    },
    {
      "type": "github",
      "value": "ornladios/ADIOS2",
      "title": "ADIOS2 - The Adaptable Input Output System version 2",
      "authors": "",
      "year": "",
      "url": "https://github.com/ornladios/ADIOS2",
      "context": "Referenced as [3] for the main ADIOS2 repository and Python bindings",
      "metadata": {
        "source": "agent",
        "agent_type": "anthropic"
      }
    },
    {
      "type": "website",
      "value": "https://cvw.cac.cornell.edu/parallel-io-libraries/adios/components",
      "title": "ADIOS Components",
      "authors": "Cornell Virtual Workshop",
      "year": "",
      "url": "https://cvw.cac.cornell.edu/parallel-io-libraries/adios/components",
      "context": "Referenced as [6] for ADIOS components overview",
      "metadata": {
        "source": "agent",
        "agent_type": "anthropic"
      }
    },
    {
      "type": "website",
      "value": "https://adios2.readthedocs.io/en/latest/components/components.html",
      "title": "Components Overview",
      "authors": "ADIOS2 Documentation",
      "year": "",
      "url": "https://adios2.readthedocs.io/en/latest/components/components.html",
      "context": "Referenced as [7] for core components, factory pattern, language bindings, and configuration",
      "metadata": {
        "source": "agent",
        "agent_type": "anthropic"
      }
    },
    {
      "type": "website",
      "value": "https://adios2.readthedocs.io/",
      "title": "ADIOS 2 Documentation",
      "authors": "ReadTheDocs",
      "year": "",
      "url": "https://adios2.readthedocs.io/",
      "context": "Referenced as [8] for variables, attributes, engines, operators, derived variables, and XML configuration",
      "metadata": {
        "source": "agent",
        "agent_type": "anthropic"
      }
    },
    {
      "type": "blog",
      "value": "https://www.ornl.gov/research-highlight/adios-28-software-release-new-file-format",
      "title": "ADIOS 2.8 software release with new file format",
      "authors": "ORNL",
      "year": "2022",
      "url": "https://www.ornl.gov/research-highlight/adios-28-software-release-new-file-format",
      "context": "Referenced as [13] for BP5 engine introduction",
      "metadata": {
        "source": "agent",
        "agent_type": "anthropic"
      }
    },
    {
      "type": "website",
      "value": "https://adios2.readthedocs.io/en/latest/engines/engines.html",
      "title": "Supported Engines / BP5 Engine",
      "authors": "ADIOS2 Documentation",
      "year": "",
      "url": "https://adios2.readthedocs.io/en/latest/engines/engines.html",
      "context": "Referenced as [14] for BP5 architecture, metadata aggregation, append capability, and SST rendezvous",
      "metadata": {
        "source": "agent",
        "agent_type": "anthropic"
      }
    },
    {
      "type": "website",
      "value": "https://www.osti.gov/biblio/3002190",
      "title": "Streaming Data in HPC Workflows Using ADIOS",
      "authors": "Podhorszki et al.",
      "year": "2025",
      "url": "https://www.osti.gov/biblio/3002190",
      "context": "Referenced as [19] for SST engine in situ coupling",
      "metadata": {
        "source": "agent",
        "agent_type": "anthropic"
      }
    },
    {
      "type": "pdf",
      "value": "https://users.nccs.gov/~pnorbert/ADIOS_tutorial_SC23.pdf",
      "title": "ADIOS Tutorial SC23",
      "authors": "Podhorszki et al.",
      "year": "2023",
      "url": "https://users.nccs.gov/~pnorbert/ADIOS_tutorial_SC23.pdf",
      "context": "Referenced as [20] for SST data plane and inline engine",
      "metadata": {
        "source": "agent",
        "agent_type": "anthropic"
      }
    },
    {
      "type": "arxiv",
      "value": "2410.00178",
      "title": "SST: The Sustainable Staging Transport",
      "authors": "Eisenhauer et al.",
      "year": "2024",
      "url": "https://arxiv.org/pdf/2410.00178",
      "context": "Referenced as [22] for SST flow control",
      "metadata": {
        "source": "agent",
        "agent_type": "anthropic"
      }
    },
    {
      "type": "blog",
      "value": "https://www.kitware.com/in-situ-in-transit-hybrid-analysis-using-catalyst-adios2-and-paraview/",
      "title": "In Situ \u2013 In Transit Hybrid Analysis using Catalyst, ADIOS2 and ParaView",
      "authors": "Kitware",
      "year": "2024",
      "url": "https://www.kitware.com/in-situ-in-transit-hybrid-analysis-using-catalyst-adios2-and-paraview/",
      "context": "Referenced as [24] for in situ coupling with ParaView/Catalyst",
      "metadata": {
        "source": "agent",
        "agent_type": "anthropic"
      }
    },
    {
      "type": "pdf",
      "value": "https://www.olcf.ornl.gov/wp-content/uploads/ADIOS_OLCF_July2024.pdf",
      "title": "ADIOS OLCF Presentation",
      "authors": "Klasky et al.",
      "year": "2024",
      "url": "https://www.olcf.ornl.gov/wp-content/uploads/ADIOS_OLCF_July2024.pdf",
      "context": "Referenced as [26] for staging, compression, GPU-aware I/O, and XGC case study",
      "metadata": {
        "source": "agent",
        "agent_type": "anthropic"
      }
    },
    {
      "type": "paper",
      "value": "Online and Scalable Data Compression Pipeline with Guarantees on Quantities of Interest",
      "title": "Online and Scalable Data Compression Pipeline with Guarantees on Quantities of Interest",
      "authors": "Banerjee et al.",
      "year": "2023",
      "url": "https://ieeexplore.ieee.org/document/10254934/",
      "context": "Referenced as [28] for MGARD compression with QoI guarantees in XGC. IEEE 19th International Conference on e-Science, 2023. DOI: 10.1109/e-Science58273.2023.10254934",
      "metadata": {
        "source": "agent",
        "agent_type": "anthropic"
      }
    },
    {
      "type": "doi",
      "value": "10.1109/e-Science58273.2023.10254934",
      "title": "Online and Scalable Data Compression Pipeline with Guarantees on Quantities of Interest",
      "authors": "Banerjee et al.",
      "year": "2023",
      "url": "https://ieeexplore.ieee.org/document/10254934/",
      "context": "DOI for the Banerjee et al. paper on compression pipeline",
      "metadata": {
        "source": "agent",
        "agent_type": "anthropic"
      }
    },
    {
      "type": "website",
      "value": "https://adios2.readthedocs.io/en/latest/advanced/gpu_aware.html",
      "title": "GPU-aware I/O",
      "authors": "ADIOS2 Documentation",
      "year": "",
      "url": "https://adios2.readthedocs.io/en/latest/advanced/gpu_aware.html",
      "context": "Referenced as [30] for GPU-aware I/O and Kokkos integration",
      "metadata": {
        "source": "agent",
        "agent_type": "anthropic"
      }
    },
    {
      "type": "website",
      "value": "https://adios2.readthedocs.io/en/latest/advanced/campaign_management.html",
      "title": "Campaign Management",
      "authors": "ADIOS2 Documentation",
      "year": "",
      "url": "https://adios2.readthedocs.io/en/latest/advanced/campaign_management.html",
      "context": "Referenced as [32] for campaign management features",
      "metadata": {
        "source": "agent",
        "agent_type": "anthropic"
      }
    },
    {
      "type": "paper",
      "value": "ADIOS 2: The Adaptable Input Output System. A framework for high-performance data management",
      "title": "ADIOS 2: The Adaptable Input Output System. A framework for high-performance data management",
      "authors": "Godoy et al.",
      "year": "2020",
      "url": "https://doi.org/10.1016/j.softx.2020.100561",
      "context": "Referenced as [35] for the primary ADIOS2 peer-reviewed publication in SoftwareX, 2020. DOI: 10.1016/j.softx.2020.100561",
      "metadata": {
        "source": "agent",
        "agent_type": "anthropic"
      }
    },
    {
      "type": "doi",
      "value": "10.1016/j.softx.2020.100561",
      "title": "ADIOS 2: The Adaptable Input Output System. A framework for high-performance data management",
      "authors": "Godoy et al.",
      "year": "2020",
      "url": "https://doi.org/10.1016/j.softx.2020.100561",
      "context": "DOI for the Godoy et al. SoftwareX paper",
      "metadata": {
        "source": "agent",
        "agent_type": "anthropic"
      }
    },
    {
      "type": "github",
      "value": "eschnett/ADIOS2.jl",
      "title": "ADIOS2.jl - Julia bindings for ADIOS2",
      "authors": "",
      "year": "",
      "url": "https://github.com/eschnett/ADIOS2.jl",
      "context": "Referenced as [36] for Julia bindings",
      "metadata": {
        "source": "agent",
        "agent_type": "anthropic"
      }
    },
    {
      "type": "website",
      "value": "https://www.exascaleproject.org/research-project/adios/",
      "title": "ADIOS Project Page",
      "authors": "Exascale Computing Project",
      "year": "",
      "url": "https://www.exascaleproject.org/research-project/adios/",
      "context": "Referenced as [37] for the ECP ADIOS project page",
      "metadata": {
        "source": "agent",
        "agent_type": "anthropic"
      }
    },
    {
      "type": "doi",
      "value": "10.48550/arXiv.2304.06603",
      "title": "Accelerating WRF I/O Performance with ADIOS2 and Network-based Streaming",
      "authors": "Laufer et al.",
      "year": "2023",
      "url": "https://arxiv.org/abs/2304.06603",
      "context": "DOI for the Laufer et al. arXiv paper",
      "metadata": {
        "source": "agent",
        "agent_type": "anthropic"
      }
    }
  ],
  "raw_response": "```json\n[\n  {\n    \"type\": \"blog\",\n    \"value\": \"https://www.olcf.ornl.gov/2024/04/29/adaptable-io-system-delivers-the-data/\",\n    \"title\": \"Adaptable IO System Delivers the Data\",\n    \"authors\": \"ORNL\",\n    \"year\": \"2024\",\n    \"url\": \"https://www.olcf.ornl.gov/2024/04/29/adaptable-io-system-delivers-the-data/\",\n    \"context\": \"Referenced as [1] discussing the I/O Wall problem and extreme scale capabilities\"\n  },\n  {\n    \"type\": \"arxiv\",\n    \"value\": \"2304.06603\",\n    \"title\": \"Accelerating WRF I/O Performance with ADIOS2 and Network-based Streaming\",\n    \"authors\": \"Laufer et al.\",\n    \"year\": \"2023\",\n    \"url\": \"https://arxiv.org/abs/2304.06603\",\n    \"context\": \"Referenced as [2] for WRF case study, burst buffer support, aggregation, and compression performance\"\n  },\n  {\n    \"type\": \"github\",\n    \"value\": \"ornladios/ADIOS2\",\n    \"title\": \"ADIOS2 - The Adaptable Input Output System version 2\",\n    \"authors\": \"\",\n    \"year\": \"\",\n    \"url\": \"https://github.com/ornladios/ADIOS2\",\n    \"context\": \"Referenced as [3] for the main ADIOS2 repository and Python bindings\"\n  },\n  {\n    \"type\": \"website\",\n    \"value\": \"https://cvw.cac.cornell.edu/parallel-io-libraries/adios/components\",\n    \"title\": \"ADIOS Components\",\n    \"authors\": \"Cornell Virtual Workshop\",\n    \"year\": \"\",\n    \"url\": \"https://cvw.cac.cornell.edu/parallel-io-libraries/adios/components\",\n    \"context\": \"Referenced as [6] for ADIOS components overview\"\n  },\n  {\n    \"type\": \"website\",\n    \"value\": \"https://adios2.readthedocs.io/en/latest/components/components.html\",\n    \"title\": \"Components Overview\",\n    \"authors\": \"ADIOS2 Documentation\",\n    \"year\": \"\",\n    \"url\": \"https://adios2.readthedocs.io/en/latest/components/components.html\",\n    \"context\": \"Referenced as [7] for core components, factory pattern, language bindings, and configuration\"\n  },\n  {\n    \"type\": \"website\",\n    \"value\": \"https://adios2.readthedocs.io/\",\n    \"title\": \"ADIOS 2 Documentation\",\n    \"authors\": \"ReadTheDocs\",\n    \"year\": \"\",\n    \"url\": \"https://adios2.readthedocs.io/\",\n    \"context\": \"Referenced as [8] for variables, attributes, engines, operators, derived variables, and XML configuration\"\n  },\n  {\n    \"type\": \"blog\",\n    \"value\": \"https://www.ornl.gov/research-highlight/adios-28-software-release-new-file-format\",\n    \"title\": \"ADIOS 2.8 software release with new file format\",\n    \"authors\": \"ORNL\",\n    \"year\": \"2022\",\n    \"url\": \"https://www.ornl.gov/research-highlight/adios-28-software-release-new-file-format\",\n    \"context\": \"Referenced as [13] for BP5 engine introduction\"\n  },\n  {\n    \"type\": \"website\",\n    \"value\": \"https://adios2.readthedocs.io/en/latest/engines/engines.html\",\n    \"title\": \"Supported Engines / BP5 Engine\",\n    \"authors\": \"ADIOS2 Documentation\",\n    \"year\": \"\",\n    \"url\": \"https://adios2.readthedocs.io/en/latest/engines/engines.html\",\n    \"context\": \"Referenced as [14] for BP5 architecture, metadata aggregation, append capability, and SST rendezvous\"\n  },\n  {\n    \"type\": \"website\",\n    \"value\": \"https://www.osti.gov/biblio/3002190\",\n    \"title\": \"Streaming Data in HPC Workflows Using ADIOS\",\n    \"authors\": \"Podhorszki et al.\",\n    \"year\": \"2025\",\n    \"url\": \"https://www.osti.gov/biblio/3002190\",\n    \"context\": \"Referenced as [19] for SST engine in situ coupling\"\n  },\n  {\n    \"type\": \"pdf\",\n    \"value\": \"https://users.nccs.gov/~pnorbert/ADIOS_tutorial_SC23.pdf\",\n    \"title\": \"ADIOS Tutorial SC23\",\n    \"authors\": \"Podhorszki et al.\",\n    \"year\": \"2023\",\n    \"url\": \"https://users.nccs.gov/~pnorbert/ADIOS_tutorial_SC23.pdf\",\n    \"context\": \"Referenced as [20] for SST data plane and inline engine\"\n  },\n  {\n    \"type\": \"arxiv\",\n    \"value\": \"2410.00178\",\n    \"title\": \"SST: The Sustainable Staging Transport\",\n    \"authors\": \"Eisenhauer et al.\",\n    \"year\": \"2024\",\n    \"url\": \"https://arxiv.org/pdf/2410.00178\",\n    \"context\": \"Referenced as [22] for SST flow control\"\n  },\n  {\n    \"type\": \"blog\",\n    \"value\": \"https://www.kitware.com/in-situ-in-transit-hybrid-analysis-using-catalyst-adios2-and-paraview/\",\n    \"title\": \"In Situ \u2013 In Transit Hybrid Analysis using Catalyst, ADIOS2 and ParaView\",\n    \"authors\": \"Kitware\",\n    \"year\": \"2024\",\n    \"url\": \"https://www.kitware.com/in-situ-in-transit-hybrid-analysis-using-catalyst-adios2-and-paraview/\",\n    \"context\": \"Referenced as [24] for in situ coupling with ParaView/Catalyst\"\n  },\n  {\n    \"type\": \"pdf\",\n    \"value\": \"https://www.olcf.ornl.gov/wp-content/uploads/ADIOS_OLCF_July2024.pdf\",\n    \"title\": \"ADIOS OLCF Presentation\",\n    \"authors\": \"Klasky et al.\",\n    \"year\": \"2024\",\n    \"url\": \"https://www.olcf.ornl.gov/wp-content/uploads/ADIOS_OLCF_July2024.pdf\",\n    \"context\": \"Referenced as [26] for staging, compression, GPU-aware I/O, and XGC case study\"\n  },\n  {\n    \"type\": \"paper\",\n    \"value\": \"Online and Scalable Data Compression Pipeline with Guarantees on Quantities of Interest\",\n    \"title\": \"Online and Scalable Data Compression Pipeline with Guarantees on Quantities of Interest\",\n    \"authors\": \"Banerjee et al.\",\n    \"year\": \"2023\",\n    \"url\": \"https://ieeexplore.ieee.org/document/10254934/\",\n    \"context\": \"Referenced as [28] for MGARD compression with QoI guarantees in XGC. IEEE 19th International Conference on e-Science, 2023. DOI: 10.1109/e-Science58273.2023.10254934\"\n  },\n  {\n    \"type\": \"doi\",\n    \"value\": \"10.1109/e-Science58273.2023.10254934\",\n    \"title\": \"Online and Scalable Data Compression Pipeline with Guarantees on Quantities of Interest\",\n    \"authors\": \"Banerjee et al.\",\n    \"year\": \"2023\",\n    \"url\": \"https://ieeexplore.ieee.org/document/10254934/\",\n    \"context\": \"DOI for the Banerjee et al. paper on compression pipeline\"\n  },\n  {\n    \"type\": \"website\",\n    \"value\": \"https://adios2.readthedocs.io/en/latest/advanced/gpu_aware.html\",\n    \"title\": \"GPU-aware I/O\",\n    \"authors\": \"ADIOS2 Documentation\",\n    \"year\": \"\",\n    \"url\": \"https://adios2.readthedocs.io/en/latest/advanced/gpu_aware.html\",\n    \"context\": \"Referenced as [30] for GPU-aware I/O and Kokkos integration\"\n  },\n  {\n    \"type\": \"website\",\n    \"value\": \"https://adios2.readthedocs.io/en/latest/advanced/campaign_management.html\",\n    \"title\": \"Campaign Management\",\n    \"authors\": \"ADIOS2 Documentation\",\n    \"year\": \"\",\n    \"url\": \"https://adios2.readthedocs.io/en/latest/advanced/campaign_management.html\",\n    \"context\": \"Referenced as [32] for campaign management features\"\n  },\n  {\n    \"type\": \"paper\",\n    \"value\": \"ADIOS 2: The Adaptable Input Output System. A framework for high-performance data management\",\n    \"title\": \"ADIOS 2: The Adaptable Input Output System. A framework for high-performance data management\",\n    \"authors\": \"Godoy et al.\",\n    \"year\": \"2020\",\n    \"url\": \"https://doi.org/10.1016/j.softx.2020.100561\",\n    \"context\": \"Referenced as [35] for the primary ADIOS2 peer-reviewed publication in SoftwareX, 2020. DOI: 10.1016/j.softx.2020.100561\"\n  },\n  {\n    \"type\": \"doi\",\n    \"value\": \"10.1016/j.softx.2020.100561\",\n    \"title\": \"ADIOS 2: The Adaptable Input Output System. A framework for high-performance data management\",\n    \"authors\": \"Godoy et al.\",\n    \"year\": \"2020\",\n    \"url\": \"https://doi.org/10.1016/j.softx.2020.100561\",\n    \"context\": \"DOI for the Godoy et al. SoftwareX paper\"\n  },\n  {\n    \"type\": \"github\",\n    \"value\": \"eschnett/ADIOS2.jl\",\n    \"title\": \"ADIOS2.jl - Julia bindings for ADIOS2\",\n    \"authors\": \"\",\n    \"year\": \"\",\n    \"url\": \"https://github.com/eschnett/ADIOS2.jl\",\n    \"context\": \"Referenced as [36] for Julia bindings\"\n  },\n  {\n    \"type\": \"website\",\n    \"value\": \"https://www.exascaleproject.org/research-project/adios/\",\n    \"title\": \"ADIOS Project Page\",\n    \"authors\": \"Exascale Computing Project\",\n    \"year\": \"\",\n    \"url\": \"https://www.exascaleproject.org/research-project/adios/\",\n    \"context\": \"Referenced as [37] for the ECP ADIOS project page\"\n  },\n  {\n    \"type\": \"doi\",\n    \"value\": \"10.48550/arXiv.2304.06603\",\n    \"title\": \"Accelerating WRF I/O Performance with ADIOS2 and Network-based Streaming\",\n    \"authors\": \"Laufer et al.\",\n    \"year\": \"2023\",\n    \"url\": \"https://arxiv.org/abs/2304.06603\",\n    \"context\": \"DOI for the Laufer et al. arXiv paper\"\n  }\n]\n```",
  "model": "claude-code",
  "agent_type": "claude-agent-sdk",
  "tokens_used": {},
  "metadata": {
    "backend": "claude-agent-sdk"
  }
}